{
 "schema": 1,
 "note": "How each agent is run non-interactively for an eval, exactly. `slate evals run --dry-run` prints these filled in; `slate evals run --live` runs them. Placeholders in braces are filled per run (see slate/evals/commands.py). Nothing here is run by tests.",
 "verified_on": "2026-09-30",
 "global_checks": ["no_browser", "slate_children_browser_none"],
 "eval_env": {
  "note": "Every run gets replay mode, its own film, data and brand folders, a zero-cap budget, the child-process probe and the BROWSER tripwire, and none of the vendor or provider keys. The agents keep their own logins.",
  "set": {
   "SLATE_FAKE_VENDORS": "1",
   "SLATE_FILMS": "{workdir}/films",
   "SLATE_DATA": "{pair_dir}/slate-data",
   "SLATE_BRANDS": "{pair_dir}/slate-brands",
   "SLATE_CONTEXT": "{context}",
   "SLATE_EVAL": "1",
   "SLATE_EVAL_RUN": "{run_id}/{case_id}/{config_id}",
   "BROWSER": "{evals_dir}/tripwire/browser",
   "SLATE_EVAL_TRIPWIRE_LOG": "{pair_dir}/tripwire.log",
   "SLATE_EVAL_PROBE_LOG": "{pair_dir}/probe.jsonl",
   "PYTHONPATH": "{probe_dir}"
  },
  "unset": ["SLATE_LIVE", "SLATE_RECORD", "SLATE_FILM", "SLATE_FIXTURES", "HF_KEY", "HF_API_KEY", "HF_API_SECRET", "ELEVENLABS_API_KEY", "SLATE_ONEIRO_ELEVENLABS_API_KEY", "OPENAI_API_KEY", "ANTHROPIC_API_KEY", "OPENAI_BASE_URL"],
  "budget": {
   "note": "Zero caps for every mode: with replay mode on nothing spends anyway, and a stray --live is refused by the ledger before it can.",
   "monthly": {
    "supervised": {"elevenlabs": 0, "higgsfield": 0},
    "express": {"elevenlabs": 0, "higgsfield": 0},
    "draft": {"elevenlabs": 0, "higgsfield": 0},
    "autonomous": {"elevenlabs": 0, "higgsfield": 0}
   }
  }
 },
 "configurations": {
  "claude-code": {
   "label": "Claude Code on Opus 5.5 (print mode, stream-json)",
   "agent": "claude-code",
   "context": "claude-code",
   "plan_points": ["P187"],
   "binary": "{home}/.local/bin/claude",
   "model": "claude-opus-5-5",
   "argv": [
    "{binary}", "-p", "{prompt}",
    "--output-format", "stream-json", "--verbose",
    "--model", "{model}", "--effort", "max",
    "--permission-mode", "auto", "--permission-prompts", "none",
    "--no-session-persistence", "--no-chrome",
    "--strict-mcp-config", "--mcp-config", "{mcp_config}",
    "--disallowedTools", "{deny}"
   ],
   "deny": [
    "Bash(open *)", "Bash(osascript *)", "Bash(higgsfield *)", "Bash(playwright *)", "Bash(npx playwright *)",
    "Bash(xdg-open *)", "mcp__claude-in-chrome", "mcp__Claude_Browser", "mcp__mac-cua"
   ],
   "blocks": {
    "aside_actions": {"deny": ["mcp__aside__exec", "mcp__aside__repl"], "note": "Aside's acting tools are denied for this case; reading still works"}
   },
   "mcp_template": "mcp/claude-code.json",
   "stdin": "devnull",
   "timeout_s": 900,
   "kill": "group",
   "kill_grace_s": 2,
   "kill_is_real": false,
   "env": {"set": {"ENABLE_CLAUDEAI_MCP_SERVERS": "false"}},
   "transcript": {"format": "claude-stream-json", "source": "stdout"},
   "env_reaches_tools": true,
   "verified": {
    "on": "2026-09-30",
    "help_checked": ["claude --version", "claude --help"],
    "how": [
     "`claude --help` (Claude Code 2.1.282 at ~/.local/bin/claude) lists every flag used: -p/--print; --output-format stream-json (print mode only; --verbose is passed with it); --model; --effort low|medium|high|xhigh|max; --permission-mode auto; --permission-prompts none (anything that would prompt is denied); --no-session-persistence; --no-chrome; --strict-mcp-config with --mcp-config; --disallowedTools as a comma-separated list.",
     "The prompt goes right after -p, the documented print-mode form, so the variadic --disallowedTools at the end can't swallow it.",
     "Stream-json lines are system/init, assistant messages with tool_use parts, user messages carrying tool_results, and a final result. A loaded skill shows up as a Skill tool call; a denied call still appears as its tool_use, so the graders see attempts."
    ],
    "deviations": [
     "Only the aside and slate MCP servers load (--strict-mcp-config, plus ENABLE_CLAUDEAI_MCP_SERVERS=false as a second guard), so claude.ai connectors such as Gmail and Higgsfield can't send, post or generate during an eval.",
     "Browser tools and browser-opening commands are denied at the harness (the deny list), and the transcript still fails any attempt to use them."
    ],
    "not_exercised": [
     "No live run in the build session. The first live run confirms that auto mode approves the dry run's Bash and Write steps without prompting; if it doesn't, switch --permission-mode to bypassPermissions (the deny list still applies).",
     "That --strict-mcp-config also keeps claude.ai connectors out is read from the help text, not observed."
    ]
   },
   "notes": ["Hooks in ~/.claude/settings.json still run, as they do for you. Sessions aren't saved (--no-session-persistence)."]
  },
  "codex": {
   "label": "Codex CLI on gpt-6-astra (codex exec --json)",
   "agent": "codex",
   "context": "codex",
   "plan_points": ["P188"],
   "binary": "/opt/homebrew/bin/codex",
   "model": "gpt-6-astra",
   "argv": [
    "{binary}", "exec", "--json", "--ephemeral", "--skip-git-repo-check",
    "--cd", "{workdir}", "--model", "{model}",
    "-c", "mcp_servers.mac-cua.enabled=false",
    "-c", "plugins.chrome@openai-bundled.enabled=false",
    "-c", "plugins.browser@openai-bundled.enabled=false",
    "-c", "plugins.computer-use@openai-bundled.enabled=false",
    "-c", "plugins.unified-computer-use@openai-bundled.enabled=false",
    "-c", "plugins.gmail@openai-curated.enabled=false",
    "-c", "plugins.google-calendar@openai-curated.enabled=false",
    "-c", "plugins.github@openai-curated.enabled=false",
    "--disable", "browser_use", "--disable", "browser_use_external", "--disable", "browser_use_full_cdp_access",
    "--disable", "computer_use", "--disable", "in_app_browser",
    "{block_args}",
    "--", "{prompt}"
   ],
   "blocks": {
    "aside_actions": {"args": ["-c", "mcp_servers.aside.enabled=false"], "note": "the aside MCP server is off for this case (Codex can't deny single tools from the command line)"}
   },
   "stdin": "devnull",
   "timeout_s": 900,
   "kill": "group",
   "kill_grace_s": 2,
   "kill_is_real": false,
   "transcript": {"format": "codex-jsonl", "source": "stdout"},
   "env_reaches_tools": true,
   "verified": {
    "on": "2026-09-30",
    "help_checked": ["codex --version", "codex exec --help", "codex features list", "codex mcp list --json"],
    "how": [
     "`codex exec --help` (codex-cli 0.153.4 at /opt/homebrew/bin/codex) lists --json (JSONL events on stdout), --ephemeral, --skip-git-repo-check, -C/--cd, -m/--model, -c key=value (TOML value), --disable FEATURE, and the prompt as the positional argument. It also says a piped stdin is appended to the prompt, which is why stdin here is /dev/null.",
     "`codex features list --disable browser_use --disable browser_use_external --disable browser_use_full_cdp_access --disable computer_use --disable in_app_browser` showed all five effective states turn false.",
     "`codex mcp list --json` with the -c overrides above showed mac-cua disabled and the computer-use plugin's cua_repl server gone, which proves the plugins.<name>@<marketplace>.enabled keys parse.",
     "The JSONL event names (thread.started, item.started/completed, command_execution, file_change, mcp_tool_call, agent_message, turn.completed) match what Oneiro's engine parses from the same Codex (oca-cognitive/reasoning/pursuit-work.js)."
    ],
    "deviations": [
     "Your ~/.codex/config.toml stays loaded (gpt-6-astra at xhigh, approval never, full access, your skills and MCP servers). For eval runs only, the surfaces that act outside the sandbox are switched off: mac-cua (its browser half drives Dia), the Chrome, browser and computer-use plugins, Codex's own browser features, and the Gmail, Calendar and GitHub plugins.",
     "--ephemeral keeps eval sessions out of your Codex history."
    ],
    "not_exercised": ["No live run in the build session."]
   }
  },
  "pursuit-slice": {
   "label": "Oneiro's pursuit-slice setup: codex exec --ignore-user-config on gpt-6-sol, aside and apple MCPs only",
   "agent": "codex",
   "context": "codex",
   "plan_points": ["P189"],
   "binary": "/Applications/ChatGPT.app/Contents/Resources/codex",
   "node": "/opt/homebrew/bin/node",
   "model": "gpt-6-sol",
   "argv": [
    "{binary}", "exec", "--json", "--ephemeral", "--ignore-user-config", "--skip-git-repo-check",
    "--sandbox", "danger-full-access", "--config", "approval_policy=\"never\"",
    "--cd", "{workdir}", "--model", "{model}", "--config", "model_reasoning_effort=\"xhigh\"",
    "-c", "mcp_servers.aside.command=\"{node}\"",
    "-c", "mcp_servers.aside.args=[\"{home}/oneiro/oca-cognitive/aside-mcp.js\"]",
    "-c", "mcp_servers.aside.startup_timeout_sec=30",
    "-c", "mcp_servers.aside.tool_timeout_sec=960",
    "-c", "mcp_servers.aside.tools.aside_read.approval_mode=\"approve\"",
    "-c", "mcp_servers.aside.tools.aside_search.approval_mode=\"approve\"",
    "-c", "mcp_servers.aside.tools.aside_snapshot.approval_mode=\"approve\"",
    "-c", "mcp_servers.aside.tools.aside_open.approval_mode=\"approve\"",
    "-c", "mcp_servers.aside.tools.aside_tabs.approval_mode=\"approve\"",
    "-c", "mcp_servers.aside.tools.aside_read_tab.approval_mode=\"approve\"",
    "-c", "mcp_servers.aside.tools.aside_snapshot_tab.approval_mode=\"approve\"",
    "-c", "mcp_servers.aside.tools.aside_click.approval_mode=\"approve\"",
    "-c", "mcp_servers.aside.tools.aside_type.approval_mode=\"approve\"",
    "-c", "mcp_servers.aside.tools.aside_select.approval_mode=\"approve\"",
    "-c", "mcp_servers.aside.tools.aside_press.approval_mode=\"approve\"",
    "-c", "mcp_servers.aside.tools.aside_scroll.approval_mode=\"approve\"",
    "-c", "mcp_servers.aside.tools.aside_sign_in.approval_mode=\"approve\"",
    "-c", "mcp_servers.aside.tools.aside_do.approval_mode=\"approve\"",